{
  "policy_type": "ADMISSORIUM_ACTUATOR_POLICY",
  "schema_version": "1.0.0",
  "admissorium_version": "0.2.0",
  "truth_warning": "NOT_TRUTH_SOURCE",
  "primary_role": "sealed-admissibility-control-plane",
  "may_read": true,
  "may_audit": true,
  "may_emit_reports": true,
  "may_emit_check_runs": true,
  "may_block_merge": true,
  "may_quarantine": true,
  "may_compile_dry_run_repair": true,
  "may_comment_on_pr": true,
  "may_open_projection_repair_pr": false,
  "may_open_quarantine_issue": false,
  "may_rewrite_current_truth_objects": false,
  "may_mutate_law": false,
  "may_mutate_accepted_state": false,
  "may_modify_freeze_objects": false,
  "may_issue_authority": false,
  "may_emit_execution_receipts": false,
  "may_verify_as_final_source": false,
  "may_recognize_terminal_truth": false,
  "may_assign_recourse": false,
  "may_publish_packages": false,
  "may_write_main": false,
  "may_bypass_governance_review": false,
  "required_proofs": [
    "no_truth_mutation_path",
    "no_direct_main_write",
    "no_package_publish_path",
    "no_secret_persistence",
    "protected_truth_firewall_passed",
    "emergency_stop_tested",
    "hostile_fixtures_passed"
  ]
}
